id,group,sub_group,concept,subcategory,category,last_date,raw,zscore,zscore_1w_ago,zscore_4w_ago,zscore_13w_ago,zscore_peak_abs_13w,zscore_trend,regime,fwd_regime,formula_note
US_G1,US,Equity,Equity,Sector Rotation,Growth / cyclicals vs defensives,2026-05-29,0.36859,1.0552,0.7517,0.8039,0.1235,1.1775,stable,pro-growth,stable,S&P 500 Consumer Discretionary / S&P 500 Consumer Staples
US_G2,US,Equity,Equity,Sector Rotation,Growth / broader cyclicals vs defensives,2026-05-29,0.556134,1.4995,1.3139,1.3294,0.9881,1.5857,stable,risk-on,stable,(S&P 500 Industrials + S&P 500 Financials) / (S&P 500 Utilities + S&P 500 Consumer Staples)
US_EQ_F3,US,Equity Factor,Equity,Size,Size cycle (Russell),2026-05-29,-0.343341,0.3026,0.082,0.2427,-0.2,0.5161,stable,neutral,stable,Russell 2000 / Russell 1000
US_EQ_F1,US,Equity Factor,Equity,Style,Style / value vs growth,2026-05-29,0.627265,-0.5671,-0.4472,-0.2567,0.0722,0.6261,stable,mixed,stable,Russell 1000 Value / Russell 1000 Growth
US_R1,US,Rates,Rates / Yields,Yield Curve,Yield-curve slope,2026-05-29,0.76,1.5961,1.7725,1.6226,1.2771,1.8264,stable,early-cycle,stable,US 10-Year Treasury Yield - US 3-Month Treasury Yield
US_Cr2,US,Credit,Credit / Spreads,HY Spread,HY credit spread,2026-05-29,2.71,-1.1249,-1.0695,-1.0145,-0.4006,1.1249,intensifying,frothy,stable,yield(ICE BofA US High Yield Index) - US 10-Year Treasury Yield
GL_CA_I1,Global,Cross-Asset,Cross-Asset,Commodities vs Bonds,Commodities vs bonds,2026-05-29,0.266816,2.9398,3.418,4.024,2.1445,4.7276,fading,reflation,stable,Invesco DB Commodity Index Fund / ICE BofA US Treasury Index
US_V1,US,Volatility,Volatility,Term Structure,Vol term structure (equity),2026-05-29,3.370001,0.9891,0.9619,0.9974,-0.2372,2.7865,stable,normal,improving,CBOE VIX3M - 3-Month VIX - CBOE VIX Volatility Index  (or ratio VIX3M / VIX)
US_V2,US,Volatility,Volatility,Cross-Asset Vol,Rates vs equity vol,2026-05-29,1.488569,-0.8056,-0.6187,-1.0797,-1.7162,2.6973,fading,neutral,stable,MOVE Index - Bond Volatility / CBOE VIX Volatility Index
FX_CMD2,FX & Commodities,Cross-Asset,Cross-Asset,Dollar Backdrop,Dollar vs EM & commodities,2026-05-29,-0.367419,2.3861,2.2226,2.303,2.5907,2.5642,stable,weak-USD,stable,iShares MSCI Emerging Markets ETF / DXY Dollar Index and Invesco DB Commodity Index Fund / DXY Dollar Index
FX_CMD1,FX & Commodities,Cross-Asset,Cross-Asset,Commodity Ratio,Copper vs gold,2026-05-29,-6.561854,-0.6393,-0.6902,-1.2291,-2.0812,2.1897,fading,neutral,stable,Copper / Gold
M1,US,Momentum,Momentum,Equity Trend,Momentum – US equities trend,2026-05-29,0.103101,0.7328,0.5613,0.0854,-0.5826,2.5343,stable,risk-on,improving,Compare S&P 500 level to its N-month SMA (e.g. 10-month or 200-day)
M2,US,Momentum,Momentum,Multi-Asset Trend,Momentum – multi-asset trend,2026-05-29,0.8,-0.0782,-0.0782,0.8781,0.9472,1.9007,reversing,risk-on,stable,"Apply same SMA filter separately to S&P 500, iShares MSCI World ETF, ICE BofA US Treasury Index, S&P 500 Equity Real Estate Investment Trusts, Invesco DB Commodity Index Fund"
M3,US,Momentum,Momentum,Dual Momentum,Momentum – dual momentum equity/bond,2026-05-29,0.262322,1.1427,1.249,1.0642,0.125,2.0668,stable,equity-regime,stable,"Use 12-month total returns of S&P 500 and iShares MSCI World ETF vs cash (US 3-Month Treasury Yield as proxy), with bond sleeve via iShares Core Global Aggregate Bond UCITS ETF or ICE BofA US Treasury Index"
M4,US,Momentum,Momentum,Credit Trend,Momentum – US high yield vs Treasuries,2026-05-29,0.01684,-0.9675,-1.1374,-0.8394,-0.7358,2.1837,stable,carry,stable,"log(ICE BofA US HY Total Return Index (BAMLHYH0A0HYM2TRIV) / its 40-week SMA (~200-day equivalent, on weekly data). Spread override: if HY OAS (BAMLH0A0HYM2) > 600 bps, indicator forced to -1 (stress) regardless of trend."
M5,US,Momentum,Momentum,Vol-Filtered,Momentum – vol-filtered equity exposure,2026-05-29,0.162677,1.1705,1.2583,1.4216,-0.522,1.4216,fading,defensive,stable,13-week SMA vs 52-week SMA of CBOE VIX Volatility Index (on weekly data; ~3-month vs 12-month). log(VIX_13w / VIX_52w): negative = vol trending below annual average = equity-friendly.
EU_G3,Europe,Equity,Equity,Sector Rotation,Growth / cyclicals vs defensives (Europe),2026-05-29,0.709042,1.2146,1.1975,0.8628,0.7463,1.2146,intensifying,pro-growth-EU,stable,(STOXX Europe 600 Industrials + STOXX Europe 600 Banks + STOXX Europe 600 Technology) / (STOXX Europe 600 Utilities + STOXX Europe 600 Consumer Staples)
UK_G1,UK,Equity,Equity,Domestic vs Global,UK domestic vs global,2026-05-29,0.805219,-1.4166,-1.65,-2.0987,-2.7613,3.3633,fading,global-preferred,improving,FTSE 250 / FTSE 100
EU_G2,Europe,Equity,Equity,Regional Leadership,Eurozone vs US leadership,2026-05-29,-2.406239,-0.6683,-0.6868,-0.4398,0.8894,1.1433,stable,neutral,stable,Euro Stoxx 50 / S&P 500
EU_Cr1,Europe,Credit,Credit / Spreads,IG Spread,IG Spread - EUR,,,,,,,,,Insufficient Data,n/a,yield(ICE BofA Euro Corporate Bond Index) - yield(ICE BofA Euro Government Bond Index)
EU_Cr2,Europe,Credit,Credit / Spreads,HY Spread,HY Spread - EUR,2026-05-29,2.69,-1.1846,-1.1775,-1.0498,-1.2545,1.3528,stable,EU-HY-easy,stable,Option-adjusted spread on EUR-denominated BB-and-below corporate bonds (ICE BofA Euro High Yield OAS — FRED BAMLHE00EHYIOAS)
UK_R2,UK,Rates,Inflation,Breakevens,Breakeven - Proxy (return) - GBP,2026-05-29,0.128408,-0.8724,-0.7504,-0.7179,-0.7802,0.9527,stable,neutral,stable,log(iShares UK Inflation-Linked Gilt ETF (INXG.L) / iShares UK Gilt ETF (IGLT.L))
UK_Cr1,UK,Credit,Credit / Spreads,IG Spread,UK credit conditions,2026-05-29,-2.069766,1.4948,1.4212,1.4141,0.7721,1.8368,stable,credit-appetite,stable,iShares Core GBP Corporate Bond UCITS ETF / ICE BofA UK Gilt Index
EU_G4,Europe,Equity,Equity,Regional Leadership,EUR vs European cyclicals,2026-05-29,0.211887,-0.6668,-0.9021,-1.1316,-0.3691,1.8239,fading,neutral,stable,Composite of EUR/USD and STOXX Europe 600 Industrials / STOXX Europe 600 Utilities
AS_CN_G3,Asia,Equity Factor,Equity,Size,China size / domestic cycle,2026-05-29,0.027345,1.4076,1.1037,0.7591,0.2092,1.4076,intensifying,mid-cap-lead,stable,CSI 500 / CSI 300
AS_CN_G2,Asia,Equity,Equity,Regional Leadership,China vs global DM,2026-05-29,0.961556,2.2328,2.0865,1.5471,0.8093,2.2328,intensifying,China-outperform,improving,Shanghai Composite / MSCI World proxy via iShares MSCI World ETF
AS_IN_G1,Asia,Equity Factor,Equity,Size,India domestic growth breadth,2026-05-29,2.992705,-1.1419,-0.9491,-0.6632,-0.3437,1.1419,intensifying,large-cap-safety,stable,Nifty Midcap 150 / Nifty 50 and Nifty Smallcap 250 / Nifty 50
AS_CN_R1,Asia,Rates,Rates / Yields,Cross-Country Spread,China rates vs US,,,,,,,,,Insufficient Data,n/a,"China 10Y Govt Bond Yield (IRLTLT01CNM156N, FRED) minus US 10Y Treasury Yield (DGS10, FRED)"
AS_IN_R1,Asia,Rates,Rates / Yields,Cross-Country Spread,India rates vs US,2026-05-29,2.36,-0.6197,-0.8407,-0.4294,0.2335,0.9301,stable,neutral,stable,"India 10Y Govt Bond Yield (IRLTLT01INM156N, FRED) minus US 10Y Treasury Yield (DGS10, FRED)"
FX_CN1,FX & Commodities,FX,FX,Currency Direction,CNY directional momentum,2026-05-29,-0.02005,-1.1912,-1.011,-1.1551,-1.9057,1.4597,stable,CNY-weakening,stable,log(CNY=X / 26-week SMA of CNY=X). CNY=X = USD per CNY (higher = CNY stronger).
FX_1,FX & Commodities,FX,FX,Currency Direction,INR directional momentum,2026-05-29,0.03428,2.1013,3.0575,2.7392,0.9606,3.5734,fading,INR-strengthening,stable,log(INR=X / 26-week SMA of INR=X). INR=X = USD per INR (higher = INR stronger).
US_Cr1,US,Credit,Credit / Spreads,IG Spread,IG Spread,2026-05-29,0.74,-1.1993,-1.2029,-0.8191,-0.6316,1.2029,stable,frothy,stable,yield(ICE BofA US Corporate Index) - US 10-Year Treasury Yield
US_Cr3,US,Credit,Credit / Spreads,HY-IG Spread,HY/IG Spread,2026-05-29,1.97,-1.0437,-0.9592,-1.0869,-0.2649,1.0869,stable,complacent,stable,yield(ICE BofA US High Yield Index) - yield(ICE BofA US Corporate Index)
US_R2,US,Rates,Rates / Yields,Yield Curve,Yield-curve slope,2026-05-29,0.46,0.8061,0.7549,0.9504,1.23,1.2172,fading,normal,stable,US 10-Year Treasury Yield - US 2-Year Treasury Yield
US_R5,US,Rates,Rates / Yields,Real Rates,Real rates,2026-05-29,2.09,0.7507,1.1147,-0.0887,-0.6399,1.1147,stable,neutral,stable,yield(ICE BofA US Inflation-Linked Treasury Index (TIPS))
US_R4,US,Rates,Inflation,Breakevens,Inflation Breakeven,2026-05-29,2.39,0.9809,1.1108,2.1469,-0.5226,2.1893,fading,neutral,stable,US 10-Year Treasury Yield - yield(ICE BofA US Inflation-Linked Treasury Index (TIPS))
UK_R1,UK,Rates,Rates / Yields,Cross-Country Spread,GB10Y vs DM10Y,2026-05-29,1.7007,0.4909,0.0221,-0.0614,0.1677,0.5601,stable,neutral,stable,UK 10-Year Gilt Yield - Germany 10-Year Bund Yield
FX_CMD5,FX & Commodities,Growth,Growth,China Activity,Growth / China infrastructure,2026-05-29,107.577273,-0.2259,-0.2294,-0.2231,-0.9172,0.2749,stable,neutral,stable,Iron Ore (World Bank Price Index) / Copper
FX_CMD4,FX & Commodities,Growth,Growth,China Activity,Growth / China vs global commodities,2026-05-29,-6.561854,-0.6393,-0.6902,-1.2291,-2.0812,2.1897,fading,neutral,stable,Iron Ore (World Bank Price Index) / Invesco DB Commodity Index Fund
US_JOBS1,US,Macro,Labour,Initial Claims,Labour market / Leading,2026-05-29,-8.63388,-1.6566,-2.1769,-1.6925,-0.8712,2.1769,stable,overheating,stable,Initial Jobless Claims 4-Week Avg (IC4WSA) – YoY % change and z-score
US_JOBS3,US,Macro,Labour,Composite,Labour market composite,2026-05-29,-0.155128,0.9573,1.268,0.8846,0.0781,1.268,stable,mid-cycle,stable,"Equal-weighted composite of z-scores of inverted unemployment rate (USA_UNEMPLOYMENT), payroll growth (PAYEMS YoY) and inverted IC4WSA"
US_G6,US,Macro,Growth,Real Activity,Real activity / Growth,2026-05-29,1.698495,1.9881,2.0578,2.3167,1.3691,2.3167,fading,strong-growth,stable,Composite of z-scores of 12-month change in Industrial Production (INDPRO) and Retail Sales ex-Autos (RSXFS)
US_HOUS1,US,Macro,Housing,Permits,Housing / Construction,2026-05-29,0.49435,0.5669,0.5755,0.6018,1.5135,0.8858,stable,neutral,stable [leading],Building Permits (PERMIT) – 12-month % change and z-score
US_M2,US,Macro,Money / Liquidity,M2,Liquidity,2026-05-29,4.444902,0.9164,0.9264,0.957,1.1394,1.0917,stable,neutral,stable,M2 Money Supply (M2SL) – YoY % change and z-score
GL_CLI1,Global,CLI,Leading Indicators,Regional Differential,Regional growth diff (US v EU),2026-05-29,0.0054,0.1778,0.1883,0.2228,-0.5539,0.2858,fading,neutral,stable [leading],"USA_CLI minus avg(DEU_CLI, FRA_CLI). EA19 composite not available in OECD pull; DEU+FRA equal-weight average used as Eurozone proxy."
GL_CLI2,Global,CLI,Leading Indicators,Regional Differential,Regional growth diff (US v CHN),2026-05-29,2.0461,1.7081,1.7348,1.8252,2.0538,2.1045,stable,US-leads-China,stable [leading],USA_CLI minus CHN_CLI.
EU_CLI1,Europe,CLI,Leading Indicators,Regional Composite,Europe block CLI state,2026-05-29,100.832667,1.4753,1.4934,1.5474,1.8958,1.862,stable,EU-above-trend,stable [leading],"Equal-weight average of DEU_CLI, FRA_CLI, GBR_CLI (ITA excluded — not consistently available in OECD pull)."
AS_CLI1,Asia,CLI,Leading Indicators,Regional Composite,Asia (China-centred) CLI state,2026-05-29,100.020767,0.7478,0.7421,0.7447,-0.5568,0.7478,intensifying,near-trend,stable [leading],"Equal-weight average of CHN_CLI, JPN_CLI, AUS_CLI."
GL_CLI5,Global,CLI,Leading Indicators,Breadth,Global growth breadth,2026-05-29,0.666667,1.3229,1.3413,1.3991,2.5401,2.0696,stable,mixed,stable [leading],"Fraction of 9 countries (USA, DEU, FRA, GBR, ITA, JPN, CHN, AUS, CAN) where CLI > 100 AND CLI > CLI_26W_ago (above trend and improving simultaneously). Raw value = 0.0 to 1.0."
US_CLI1,US,CLI,Leading Indicators,Single Country,US CLI state,2026-05-29,100.8471,2.0854,2.1194,2.2284,2.0575,2.2682,stable,US-above-trend,stable [leading],USA_CLI (OECD amplitude-adjusted composite leading indicator).
CA_CLI1,Global,CLI,Leading Indicators,Single Country,Canada CLI state,2026-05-29,101.6715,1.8018,1.8337,1.9382,2.0829,2.1467,stable,Canada-above-trend,stable [leading],CAN_CLI (OECD amplitude-adjusted composite leading indicator).
DE_CLI1,Europe,CLI,Leading Indicators,Single Country,Germany CLI state,2026-05-29,100.8956,1.4926,1.5153,1.5869,1.8713,1.8536,stable,Germany-above-trend,stable [leading],DEU_CLI (OECD amplitude-adjusted composite leading indicator).
FR_CLI1,Europe,CLI,Leading Indicators,Single Country,France CLI state,2026-05-29,100.7878,1.9378,1.9762,2.1019,2.7958,2.7392,stable,France-above-trend,stable [leading],FRA_CLI (OECD amplitude-adjusted composite leading indicator).
UK_CLI1,UK,CLI,Leading Indicators,Single Country,UK CLI state,2026-05-29,100.8146,0.691,0.6976,0.7117,0.9569,0.9157,stable,near-trend,stable [leading],GBR_CLI (OECD amplitude-adjusted composite leading indicator).
IT_CLI1,Europe,CLI,Leading Indicators,Single Country,Italy CLI state,2026-05-29,100.643,1.3623,1.3817,1.4429,2.1881,2.0469,stable,Italy-above-trend,stable [leading],ITA_CLI (OECD amplitude-adjusted composite leading indicator).
JP_CLI1,Japan,CLI,Leading Indicators,Single Country,Japan CLI state,2026-05-29,100.3417,2.3737,2.4317,2.6282,2.0958,2.6282,stable,Japan-above-trend,stable [leading],JPN_CLI (OECD amplitude-adjusted composite leading indicator).
CN_CLI1,Asia,CLI,Leading Indicators,Single Country,China CLI state,2026-05-29,98.801,-1.4617,-1.4832,-1.5525,-1.9167,1.8893,stable,China-below-trend,stable [leading],CHN_CLI (OECD amplitude-adjusted composite leading indicator).
AU_CLI1,Asia,CLI,Leading Indicators,Single Country,Australia CLI state,2026-05-29,100.9196,1.887,1.9227,2.0406,2.0533,2.1701,stable,Australia-above-trend,stable [leading],AUS_CLI (OECD amplitude-adjusted composite leading indicator).
US_G3,US,Equity,Equity,Sector Rotation,Growth / banks vs utilities,2026-05-29,2.561738,0.6268,0.6409,0.663,0.188,0.802,stable,neutral,stable,S&P 500 Banks (^SP500-4010) / S&P 500 Utilities
US_EQ_F4,US,Equity Factor,Equity,Size,Size cycle (S&P),2026-05-29,-0.949331,0.1616,-0.0599,0.1366,-0.2332,0.5711,stable,neutral,stable,Russell 2000 / S&P 500
US_EQ_F2,US,Equity Factor,Equity,Style,Style / value vs growth (S&P 500),2026-05-29,0.491967,-1.7863,-1.6029,-1.4153,-0.7038,1.847,intensifying,growth-regime,stable,S&P 500 Value ETF (IVE) / S&P 500 Growth ETF (IVW)
US_R3,US,Rates,Rates / Yields,Yield Curve,Yield-curve slope (market return),2026-05-29,0.455,0.8044,0.759,0.9349,1.2218,1.1914,fading,normal,stable,US 10-Year Treasury Yield (^TNX yfinance) minus US 2-Year Treasury Yield (DGS2 FRED)
US_CA_G1,US,Cross-Asset,Cross-Asset,Risk-On/Off,Risk-on vs risk-off,2026-05-29,3.501183,1.9786,1.9507,1.7128,1.2846,1.9786,intensifying,risk-on,stable,S&P 500 ETF (SPY) / ICE BofA US Treasury Index (GOVT)
US_Cr4,US,Credit,Credit / Spreads,HY vs Treasuries,HY vs treasuries (credit risk),2026-05-29,-3.184861,1.4871,1.5167,1.4649,1.118,1.5636,stable,credit-appetite,stable,iShares USD High Yield Corp Bond UCITS ETF (IHYU.L) / ICE BofA US Treasury Index (GOVT)
US_G5,US,Equity,Equity,Sector Rotation,Growth / technology leadership,2026-05-29,-0.025501,3.6747,3.3833,2.612,0.624,3.7066,intensifying,tech-led,improving,Invesco QQQ Trust (QQQ) / SPDR S&P 500 ETF (SPY)
US_G4,US,Equity,Equity,Breadth,Growth / market breadth,2026-05-29,-1.287448,-1.8089,-1.763,-1.5482,-0.5936,2.0832,stable,narrow-concentrated,stable,S&P 500 Equal-Weight ETF (RSP) / SPDR S&P 500 ETF (SPY)
US_ISM1,US,Survey,Sentiment / Survey,PMI,Leading / ISM Manufacturing New Orders,2026-05-29,47.7,-0.1597,-0.1427,-0.1248,-0.0639,0.1597,intensifying,contraction,stable [leading],ISM Manufacturing New Orders Index (NAPMOI via FRED monthly)
US_R6,US,Rates,Housing,Mortgage Spread,Rates / mortgage affordability,2026-05-29,2.05,-1.2037,-1.524,-1.7314,-1.6353,2.1546,fading,housing-easy,stable,30-Year Fixed Mortgage Rate (MORTGAGE30US FRED) minus 10-Year Treasury Yield (DGS10 FRED)
US_JOBS2,US,Macro,Labour,Tightness,Labour market / JOLTS tightness,2026-05-29,0.931236,-0.9443,-0.9524,-0.978,-1.099,0.9923,stable,neutral,stable [leading],JOLTS Job Openings (JTSJOL FRED) / Unemployed Persons (UNEMPLOY FRED)
EU_R1,Europe,Rates,Rates / Yields,Cross-Country Spread,BTP-Bund,2026-05-29,0.613,-1.1229,-1.4991,-1.6529,-1.6071,1.8773,fading,compressed,stable,Italy 10-Year Govt Bond Yield (IRLTLT01ITM156N FRED) minus Germany 10-Year Bund Yield (IRLTLT01DEM156N FRED)
EU_G1,Europe,Equity,Equity,Regional Leadership,Eurozone vs global equities,2026-05-29,-1.09083,-0.1475,-0.1648,-0.0089,0.9912,0.7759,stable,neutral,stable,iShares MSCI Eurozone ETF (EZU) / iShares MSCI World ETF (URTH)
JP_G1,Japan,Equity,Equity,Regional Leadership,Japan vs global equities,2026-05-29,-0.792665,0.1732,0.1466,-0.0366,1.3694,0.8238,stable,neutral,stable,iShares MSCI Japan ETF (EWJ) / iShares MSCI World ETF (URTH)
FX_2,FX & Commodities,FX,FX,Carry,JPY carry trade signal,2026-05-29,0.019133,-0.1516,-0.3199,-0.1244,0.7202,1.0286,stable,neutral,stable [leading],USD/JPY (USDJPY=X) 26-week log momentum
AS_CN_G1,Asia,Equity,Equity,Regional Leadership,China vs broad EM divergence,2026-05-29,-0.673376,-2.6094,-2.1687,-1.6989,-1.4882,2.6094,intensifying,China-underperform-EM,deteriorating,iShares China Large-Cap ETF (FXI) / iShares MSCI EM ETF (EEM) in USD
GL_G2,Global,Cross-Asset,Cross-Asset,Risk-On/Off,Global multi-asset risk appetite,2026-05-29,1.939171,2.1354,2.094,1.9107,1.6682,2.1354,intensifying,risk-on,stable,iShares MSCI ACWI ETF (ACWI) / ICE BofA US Treasury Index (GOVT)
GL_G1,Global,Cross-Asset,Equity,Regional Leadership,EM vs DM equity relative cycle,2026-05-29,-1.093596,2.4613,1.9673,2.0769,2.0717,2.7311,stable,em-outperform,improving,iShares MSCI Emerging Markets ETF (EEM) / iShares MSCI World ETF (URTH) in USD
FX_CMD6,FX & Commodities,Momentum,Momentum,Commodity Trend,Global commodity cycle momentum,2026-05-29,0.386131,2.9898,3.0698,3.7461,2.1316,3.7607,fading,commodity-bull,stable,Invesco DB Commodity Index Tracking Fund (DBC) 52-week log return
FX_CMD3,FX & Commodities,Inflation,Cross-Asset,Commodity Ratio,Oil vs gold inflation regime,2026-05-29,-3.946007,-0.7534,-0.4975,-0.4419,-1.9464,1.101,stable,neutral,stable,WTI Crude Oil (CL=F) / Gold (GC=F) log-ratio
FX_EM1,FX & Commodities,FX,FX,EMFX Basket,EMFX basket momentum vs USD,2026-05-29,-0.007916,-0.1546,-0.4782,-0.0662,0.5173,1.0331,stable,neutral,stable,"Equal-weight basket of CNY, INR, KRW, TWD vs USD (each FX=X quote inverted so rising basket = EM currencies strengthening). Raw = log(basket / 26-week SMA)."
US_PMI1,US,Survey,Sentiment / Survey,PMI,ISM Manufacturing PMI,2026-05-29,10.3,-1.8503,-1.885,-1.9979,-2.4534,2.3907,stable,contraction,stable [leading],ISM Manufacturing PMI (DB.nomics ISM/pmi)
US_PMI2,US,Survey,Sentiment / Survey,PMI,ISM Manufacturing New Orders,2026-05-29,47.7,-0.1597,-0.1427,-0.1248,-0.0639,0.1597,intensifying,contraction,stable [leading],ISM Manufacturing New Orders sub-index (DB.nomics ISM/neword)
US_SVC1,US,Survey,Sentiment / Survey,PMI,ISM Services PMI,2026-05-29,52.0,-0.1205,-0.1157,-0.1198,-0.1377,0.1261,intensifying,neutral,stable [leading],ISM Services PMI (DB.nomics ISM/nm-pmi)
EU_PMI1,Europe,Survey,Sentiment / Survey,PMI,Eurozone Manufacturing PMI proxy,2026-05-29,-9.0,0.7316,0.7013,0.5426,0.1939,0.7316,intensifying,contraction,stable [leading],EC Industry Confidence (DB.nomics Eurostat ei_bssi_m_r2) — same 3 PMI questions
EU_PMI2,Europe,Survey,Sentiment / Survey,PMI,Eurozone Services PMI proxy,2026-05-29,5.6,0.1875,0.1795,0.119,0.0192,0.1875,intensifying,contraction,stable [leading],EC Services Confidence (DB.nomics Eurostat ei_bssi_m_r2)
EU_ESI1,Europe,Survey,Sentiment / Survey,Composite Sentiment,EC Economic Sentiment Indicator (EA),2026-05-29,96.7,1.0749,1.0787,0.9624,0.7437,1.0787,stable,above-avg-sentiment,stable [leading],EC Economic Sentiment Indicator for EA (DB.nomics Eurostat)
DE_ZEW1,Europe,Survey,Sentiment / Survey,Business Sentiment,ZEW Economic Sentiment,,,,,,,,,Insufficient Data,n/a,PROPRIETARY — ZEW Mannheim licences historical archive. No free API.
DE_IFO1,Europe,Survey,Sentiment / Survey,Business Sentiment,IFO Business Climate,2026-05-29,85.5,-0.4537,-0.4638,-0.476,0.404,0.5298,stable,neutral,stable [leading],IFO Business Climate Index (ifo Institute Excel)
UK_PMI1,Europe,Survey,Sentiment / Survey,PMI,UK Manufacturing PMI proxy,2026-05-29,-14.157362,-0.5506,-0.5561,-0.5656,-0.3977,0.6324,stable,contraction,stable [leading],OECD Business Confidence for UK (FRED BSCICP02GBM460S) — CBI-survey-derived monthly
JP_PMI1,Japan,Survey,Sentiment / Survey,PMI,Japan Manufacturing PMI,,,,,,,,,Insufficient Data,n/a,PROPRIETARY — S&P Global / au Jibun Bank. BoJ Tankan (quarterly) is best free alternative.
CN_PMI1,Asia,Survey,Sentiment / Survey,PMI,China Manufacturing PMI proxy,2026-05-29,0.6,1.2296,1.2455,1.2897,-0.9761,1.5708,stable,contraction,stable [leading],OECD Business Confidence for China (FRED CHNBSCICP02STSAM) — NBS PMI-derived monthly
CN_PMI2,Asia,Survey,Sentiment / Survey,PMI,Caixin China Manufacturing PMI,,,,,,,,,Insufficient Data,n/a,PROPRIETARY — S&P Global / Caixin. Chinese manufacturing covered by CN_PMI1 (OECD BCI).
GL_PMI1,Global,Survey,Sentiment / Survey,PMI,Global Manufacturing Survey Composite,2026-05-29,-0.109946,1.2934,1.2823,1.2063,-0.3087,1.844,stable,global-contraction,stable [leading],Z-score-normalised average: US ISM + EZ ICI + UK OECD BCI + CN OECD BCI
GLOBAL_GOLD1,Global,Cross-Asset,Cross-Asset,Precious Metals,LBMA Gold Price (PM Fix),2026-05-29,4419.45,1.4735,1.5847,1.8053,2.8825,2.6913,fading,safe-haven-bid,stable,GOLD_USD_PM (data/macro_library_lbma.csv gold_pm via sources/lbma.py)
US_INFL1,US,Inflation,Inflation,Inflation,Inflation Regime (Headline CPI + Core PCE + 5y5y Fwd),2026-05-29,2.747411,-0.6251,-0.6255,-0.6479,-0.8032,0.7029,stable,above-target,stable,"mean of US headline CPI YoY (USA_CPI), Core PCE YoY (PCEPILFE), and 5y5y forward breakeven (T5YIFR)"
UK_INFL1,UK,Inflation,Inflation,Inflation,Inflation Regime (Headline CPI — no UK core in hist yet),2026-05-29,136.1,0.9188,0.9295,0.9613,1.0415,1.0335,stable,high-inflation,stable,UK headline CPI YoY (GBR_CPI)
EU_INFL1,Eurozone,Inflation,Inflation,Inflation,Inflation Regime (Headline HICP — no EA core in hist yet),2026-05-29,1.9,-0.6889,-0.6927,-0.6919,-0.7202,0.7205,stable,on-target,stable,Euro-area headline HICP YoY (EA_HICP)
JP_INFL1,Japan,Inflation,Inflation,Inflation,Inflation Regime (Headline CPI — no JP core in hist yet),2026-05-29,2.738537,-0.4383,-0.4312,-0.4105,-0.3519,0.4383,intensifying,above-target,stable,Japan headline CPI YoY (JPN_CPI)
CN_INFL1,Asia,Inflation,Inflation,Inflation,Inflation Regime (Headline CPI + PPI — no CN core in hist yet),2026-05-29,57.16485,-0.3144,-0.302,-0.2844,-0.2735,0.3144,intensifying,reflation,stable,mean of China headline CPI YoY (CHN_CPI) and PPI YoY (CHN_PPI)
US_INFEXP1,US,Inflation,Inflation,Breakevens,Inflation Expectations,2026-05-29,0.670725,1.3792,1.5586,2.6523,-0.7526,2.6523,fading,anchored,stable [leading],"z-score-normalised average of 5y breakeven (T5YIE), 10y breakeven (T10YIE), 5y5y forward (T5YIFR), and Michigan 1y expectations (MICH)"
