series_id,col,name,category,subcategory,units,frequency,country,notes,sort_key,concept,cycle_timing,freshness_override_days,tier
V39079,CAN_POLICY_RATE,Bank of Canada Target for the Overnight Rate,Monetary Policy,Policy Rate,Percent,Daily,CAN,BoC Valet V39079 — the Bank's headline policy rate. Verified live 2026-05-28 (2.25%). Keyless JSON API.,460,Rates / Yields,L,7,0
BD.CDN.2YR.DQ.YLD,CAN_GOV_2Y,Government of Canada 2-Year Benchmark Bond Yield,Rates,Sovereign,Percent,Daily,CAN,BoC Valet BD.CDN.2YR.DQ.YLD — GoC benchmark bond yields. Short end of the CAD curve. Verified live 2026-05-28.,461,Rates / Yields,L,7,0
BD.CDN.10YR.DQ.YLD,CAN_GOV_10Y,Government of Canada 10-Year Benchmark Bond Yield,Rates,Sovereign,Percent,Daily,CAN,BoC Valet BD.CDN.10YR.DQ.YLD — GoC benchmark bond yields. Verified live 2026-05-28 (3.47%).,462,Rates / Yields,L,7,0
CPI_MEDIAN,CAN_CPI_MEDIAN,Bank of Canada CPI-median (Core Inflation),Prices,Core Inflation,Percent,Monthly,CAN,BoC Valet CPI_MEDIAN — median YoY %-change of CPI components; a preferred-core inflation measure. Verified live 2026-05-28 (2.1%).,463,Prices / Inflation,L,45,0
FXUSDCAD,CAN_USDCAD,USD/CAD Daily Average Exchange Rate,FX,Exchange Rate,CAD per USD,Daily,CAN,BoC Valet FXUSDCAD — daily average value of 1 US dollar in Canadian dollars. Verified live 2026-05-28 (1.38).,464,FX,L,7,0
