series_id,col,name,category,subcategory,units,frequency,region,notes,sort_key
Eurostat/ei_bssi_m_r2/M.BS-ESI-I.SA.EA20,EU_ESI,EC Economic Sentiment Indicator (EA),Survey,Sentiment,Index (long-run avg = 100),Monthly,EA,"EC headline ESI composite; >100 = above-average confidence. Verified: 552 obs 1980-01 → 2025-12.",70
Eurostat/ei_bssi_m_r2/M.BS-ICI-BAL.SA.EA20,EU_IND_CONF,EC Industry Confidence (EA),Survey,Sentiment,Balance (% points),Monthly,EA,"EC industrial confidence sub-indicator; balance of positive minus negative responses. Verified: 552 obs 1980-01 → 2025-12.",80
Eurostat/ei_bssi_m_r2/M.BS-SCI-BAL.SA.EA20,EU_SVC_CONF,EC Services Confidence (EA),Survey,Sentiment,Balance (% points),Monthly,EA,"EC services confidence sub-indicator; balance of positive minus negative responses. Verified: 369 obs 1995-04 → 2025-12.",90
ISM/pmi/pm,ISM_MFG_PMI,ISM Manufacturing PMI,Survey,PMI,Diffusion Index (50 = neutral),Monthly,US,"ISM headline Manufacturing PMI composite. DB.nomics mirror may lag 4-8 months. Replaces FMP calendar (paywalled 2025-08).",100
ISM/neword/pm,ISM_MFG_NEWORD,ISM Manufacturing New Orders,Survey,PMI,Diffusion Index (50 = neutral),Monthly,US,"ISM Manufacturing New Orders sub-index. Most forward-looking PMI component. Replaces FMP calendar.",110
ISM/nm-pmi/pm,ISM_SVC_PMI,ISM Services PMI (Non-Manufacturing),Survey,PMI,Diffusion Index (50 = neutral),Monthly,US,"ISM Non-Manufacturing headline PMI. Services ~70% of US GDP. Replaces FMP calendar.",120
Eurostat/sts_inpr_m/M.PROD.B-D.SCA.I21.EA20,EZ_IND_PROD,Eurozone Industrial Production,Growth,Real Activity,Index 2021=100 (SCA),Monthly,EA,"Total industry excl. construction (NACE B-D). Bloc-level factory output. Seasonally and calendar adjusted.",130
Eurostat/sts_trtu_m/M.TOVV.G47.SCA.I21.EA20,EZ_RETAIL_VOL,Eurozone Retail Sales Volume,Growth,Real Activity,Index 2021=100 (SCA),Monthly,EA,"Deflated retail turnover excl. motor vehicles (NACE G47). Harmonised volume index.",140
Eurostat/namq_10_a10_e/Q.THS_PER.TOTAL.SCA.EMP_DC.EA20,EZ_EMPLOYMENT,Eurozone Employment,Growth,Labour Market,Thousands of Persons (SCA),Quarterly,EA,"Total employment domestic concept. Cycle-coincident labour market indicator.",150
