id,group,sub_group,concept,subcategory,category,last_date,raw,zscore,zscore_1w_ago,zscore_4w_ago,zscore_13w_ago,zscore_peak_abs_13w,zscore_trend,regime,fwd_regime,formula_note
US_G1,US,Equity,Equity,Sector Rotation,Growth / cyclicals vs defensives,2026-05-15,0.319742,0.5337,0.9386,1.1775,0.1444,1.1775,fading,neutral,stable,S&P 500 Consumer Discretionary / S&P 500 Consumer Staples
US_G2,US,Equity,Equity,Sector Rotation,Growth / broader cyclicals vs defensives,2026-05-15,0.54892,1.4139,1.4893,1.5857,1.0238,1.5857,fading,risk-on,stable,(S&P 500 Industrials + S&P 500 Financials) / (S&P 500 Utilities + S&P 500 Consumer Staples)
US_EQ_F3,US,Equity Factor,Equity,Size,Size cycle (Russell),2026-05-15,-0.371439,-0.2185,0.1865,0.2232,-0.0414,0.5161,stable,neutral,stable,Russell 2000 / Russell 1000
US_EQ_F1,US,Equity Factor,Equity,Style,Style / value vs growth,2026-05-15,0.624252,-0.6261,-0.4493,-0.3861,0.0201,0.6261,intensifying,mixed,stable,Russell 1000 Value / Russell 1000 Growth
US_R1,US,Rates,Rates / Yields,Yield Curve,Yield-curve slope,2026-05-15,0.9,1.8264,1.5769,1.4644,1.3962,1.8264,intensifying,early-cycle,stable,US 10-Year Treasury Yield - US 3-Month Treasury Yield
US_Cr2,US,Credit,Credit / Spreads,HY Spread,HY credit spread,2026-05-15,2.76,-1.0317,-0.9348,-0.9065,-0.6869,1.0317,intensifying,frothy,stable,yield(ICE BofA US High Yield Index) - US 10-Year Treasury Yield
GL_CA_I1,Global,Cross-Asset,Cross-Asset,Commodities vs Bonds,Commodities vs bonds,2026-05-15,0.323476,3.8758,3.5975,3.1789,1.2071,4.7276,stable,reflation,stable,Invesco DB Commodity Index Fund / ICE BofA US Treasury Index
US_V1,US,Volatility,Volatility,Term Structure,Vol term structure (equity),2026-05-15,2.93,0.691,0.9519,0.7454,-0.3235,2.7865,stable,normal,improving,CBOE VIX3M - 3-Month VIX - CBOE VIX Volatility Index  (or ratio VIX3M / VIX)
US_V2,US,Volatility,Volatility,Cross-Asset Vol,Rates vs equity vol,2026-05-15,1.466421,-0.9003,-1.2581,-1.4493,-2.0886,2.6973,fading,neutral,stable,MOVE Index - Bond Volatility / CBOE VIX Volatility Index
FX_CMD2,FX & Commodities,Cross-Asset,Cross-Asset,Dollar Backdrop,Dollar vs EM & commodities,2026-05-15,-0.42238,2.2097,2.5642,2.3784,2.6401,2.6296,stable,weak-USD,stable,iShares MSCI Emerging Markets ETF / DXY Dollar Index and Invesco DB Commodity Index Fund / DXY Dollar Index
FX_CMD1,FX & Commodities,Cross-Asset,Cross-Asset,Commodity Ratio,Copper vs gold,2026-05-15,-6.591335,-0.8227,-1.0334,-1.3717,-2.1248,2.1897,fading,neutral,stable,Copper / Gold
M1,US,Momentum,Momentum,Equity Trend,Momentum – US equities trend,2026-05-15,0.09064,0.4585,0.506,-0.0893,-0.5256,2.5343,stable,risk-on,improving,Compare S&P 500 level to its N-month SMA (e.g. 10-month or 200-day)
M2,US,Momentum,Momentum,Multi-Asset Trend,Momentum – multi-asset trend,2026-05-15,0.8,-0.072,0.8668,0.8946,0.9697,1.9007,reversing,risk-on,improving,"Apply same SMA filter separately to S&P 500, iShares MSCI World ETF, ICE BofA US Treasury Index, S&P 500 Equity Real Estate Investment Trusts, Invesco DB Commodity Index Fund"
M3,US,Momentum,Momentum,Dual Momentum,Momentum – dual momentum equity/bond,2026-05-15,0.224959,0.6839,1.4965,2.0668,-0.2932,2.0668,fading,equity-regime,stable,"Use 12-month total returns of S&P 500 and iShares MSCI World ETF vs cash (US 3-Month Treasury Yield as proxy), with bond sleeve via iShares Core Global Aggregate Bond UCITS ETF or ICE BofA US Treasury Index"
M4,US,Momentum,Momentum,Credit Trend,Momentum – US high yield vs Treasuries,2026-05-15,0.016168,-1.03,-0.8785,-0.5904,-0.4392,2.1837,stable,carry,stable,"log(ICE BofA US HY Total Return Index (BAMLHYH0A0HYM2TRIV) / its 40-week SMA (~200-day equivalent, on weekly data). Spread override: if HY OAS (BAMLH0A0HYM2) > 600 bps, indicator forced to -1 (stress) regardless of trend."
M5,US,Momentum,Momentum,Vol-Filtered,Momentum – vol-filtered equity exposure,2026-05-15,0.176911,1.2913,1.3641,1.3386,-0.4866,1.4216,stable,defensive,stable,13-week SMA vs 52-week SMA of CBOE VIX Volatility Index (on weekly data; ~3-month vs 12-month). log(VIX_13w / VIX_52w): negative = vol trending below annual average = equity-friendly.
EU_G3,Europe,Equity,Equity,Sector Rotation,Growth / cyclicals vs defensives (Europe),2026-05-15,0.700496,1.1677,1.136,1.1927,0.7149,1.1927,stable,pro-growth-EU,stable,(STOXX Europe 600 Industrials + STOXX Europe 600 Banks + STOXX Europe 600 Technology) / (STOXX Europe 600 Utilities + STOXX Europe 600 Consumer Staples)
UK_G1,UK,Equity,Equity,Domestic vs Global,UK domestic vs global,2026-05-15,0.795841,-1.6521,-1.5278,-2.1788,-2.1396,3.3633,fading,global-preferred,stable,FTSE 250 / FTSE 100
EU_G2,Europe,Equity,Equity,Regional Leadership,Eurozone vs US leadership,2026-05-15,-2.43191,-1.1433,-0.5496,0.1966,0.7422,1.1433,intensifying,US-dominance,stable,Euro Stoxx 50 / S&P 500
EU_Cr1,Europe,Credit,Credit / Spreads,IG Spread,IG Spread - EUR,,,,,,,,,Insufficient Data,n/a,yield(ICE BofA Euro Corporate Bond Index) - yield(ICE BofA Euro Government Bond Index)
EU_Cr2,Europe,Credit,Credit / Spreads,HY Spread,HY Spread - EUR,2026-05-15,2.63,-1.3046,-1.1704,-0.8413,-1.2796,1.4069,stable,EU-HY-easy,stable,Option-adjusted spread on EUR-denominated BB-and-below corporate bonds (ICE BofA Euro High Yield OAS — FRED BAMLHE00EHYIOAS)
UK_R2,UK,Rates,Inflation,Breakevens,Breakeven - Proxy (return) - GBP,2026-05-15,0.145982,-0.8094,-0.8383,-0.8663,-1.1254,1.0084,stable,neutral,stable,log(iShares UK Inflation-Linked Gilt ETF (INXG.L) / iShares UK Gilt ETF (IGLT.L))
UK_Cr1,UK,Credit,Credit / Spreads,IG Spread,UK credit conditions,2026-05-15,-2.091332,1.5857,1.3984,1.4286,1.1275,1.5857,intensifying,credit-appetite,stable,iShares Core GBP Corporate Bond UCITS ETF / ICE BofA UK Gilt Index
EU_G4,Europe,Equity,Equity,Regional Leadership,EUR vs European cyclicals,2026-05-15,0.053975,-0.9214,-0.6749,-0.213,0.0332,1.8239,stable,neutral,stable,Composite of EUR/USD and STOXX Europe 600 Industrials / STOXX Europe 600 Utilities
AS_CN_G3,Asia,Equity Factor,Equity,Size,China size / domestic cycle,2026-05-15,-0.020372,0.95,0.7448,0.3769,-0.163,0.95,intensifying,neutral,stable,CSI 500 / CSI 300
AS_CN_G2,Asia,Equity,Equity,Regional Leadership,China vs global DM,2026-05-15,0.940664,1.9393,1.9295,1.3694,0.7552,1.9393,intensifying,China-outperform,stable,Shanghai Composite / MSCI World proxy via iShares MSCI World ETF
AS_IN_G1,Asia,Equity Factor,Equity,Size,India domestic growth breadth,2026-05-15,3.029419,-0.7575,-0.6891,-0.7742,-0.466,0.7742,stable,neutral,stable,Nifty Midcap 150 / Nifty 50 and Nifty Smallcap 250 / Nifty 50
AS_CN_R1,Asia,Rates,Rates / Yields,Cross-Country Spread,China rates vs US,,,,,,,,,Insufficient Data,n/a,"China 10Y Govt Bond Yield (IRLTLT01CNM156N, FRED) minus US 10Y Treasury Yield (DGS10, FRED)"
AS_IN_R1,Asia,Rates,Rates / Yields,Cross-Country Spread,India rates vs US,2026-05-15,2.37,-0.6178,-0.393,-0.1294,0.0673,0.6178,intensifying,neutral,stable,"India 10Y Govt Bond Yield (IRLTLT01INM156N, FRED) minus US 10Y Treasury Yield (DGS10, FRED)"
FX_CN1,FX & Commodities,FX,FX,Currency Direction,CNY directional momentum,2026-05-15,-0.021175,-1.2836,-1.2646,-1.4374,-1.5938,1.9057,fading,CNY-weakening,stable,log(CNY=X / 26-week SMA of CNY=X). CNY=X = USD per CNY (higher = CNY stronger).
FX_1,FX & Commodities,FX,FX,Currency Direction,INR directional momentum,2026-05-15,0.042925,3.0214,1.9712,1.6166,0.7842,3.5734,stable,INR-strengthening,stable,log(INR=X / 26-week SMA of INR=X). INR=X = USD per INR (higher = INR stronger).
US_Cr1,US,Credit,Credit / Spreads,IG Spread,IG Spread,2026-05-15,0.76,-1.0925,-0.9262,-0.8817,-0.956,1.0925,intensifying,frothy,stable,yield(ICE BofA US Corporate Index) - US 10-Year Treasury Yield
US_Cr3,US,Credit,Credit / Spreads,HY-IG Spread,HY/IG Spread,2026-05-15,2.0,-0.9631,-0.908,-0.892,-0.5228,1.0869,stable,neutral,stable,yield(ICE BofA US High Yield Index) - yield(ICE BofA US Corporate Index)
US_R2,US,Rates,Rates / Yields,Yield Curve,Yield-curve slope,2026-05-15,0.5,0.9071,0.8783,1.0561,1.3574,1.2632,fading,normal,stable,US 10-Year Treasury Yield - US 2-Year Treasury Yield
US_R5,US,Rates,Rates / Yields,Real Rates,Real rates,2026-05-15,2.0,0.3229,-0.013,-0.0904,-0.4321,0.9244,stable,neutral,stable,yield(ICE BofA US Inflation-Linked Treasury Index (TIPS))
US_R4,US,Rates,Inflation,Breakevens,Inflation Breakeven,2026-05-15,2.49,2.1893,1.7597,0.7518,-0.3025,2.1893,intensifying,high-inflation-exp,stable,US 10-Year Treasury Yield - yield(ICE BofA US Inflation-Linked Treasury Index (TIPS))
UK_R1,UK,Rates,Rates / Yields,Cross-Country Spread,GB10Y vs DM10Y,2026-05-15,1.824384,-0.2558,-0.2461,-0.1996,-0.6065,0.668,stable,neutral,stable,UK 10-Year Gilt Yield - Germany 10-Year Bund Yield
FX_CMD5,FX & Commodities,Growth,Growth,China Activity,Growth / China infrastructure,2026-05-15,107.577273,-0.2273,-0.2252,-0.2267,-0.9395,0.9281,stable,neutral,stable,Iron Ore (World Bank Price Index) / Copper
FX_CMD4,FX & Commodities,Growth,Growth,China Activity,Growth / China vs global commodities,2026-05-15,-6.591335,-0.8227,-1.0334,-1.3717,-2.1248,2.1897,fading,neutral,stable,Iron Ore (World Bank Price Index) / Invesco DB Commodity Index Fund
US_JOBS1,US,Macro,Labour,Initial Claims,Labour market / Leading,2026-05-15,-11.123228,-2.1377,-2.0913,-1.2155,-0.2345,2.1377,intensifying,overheating,stable,Initial Jobless Claims 4-Week Avg (IC4WSA) – YoY % change and z-score
US_JOBS3,US,Macro,Labour,Composite,Labour market composite,2026-05-15,0.006471,1.2536,1.1982,0.5789,-0.4593,1.2536,intensifying,strong-labour,stable,"Equal-weighted composite of z-scores of inverted unemployment rate (UNRATE), payroll growth (PAYEMS YoY) and inverted IC4WSA"
US_G6,US,Macro,Growth,Real Activity,Real activity / Growth,2026-05-15,1.754249,2.1376,2.2236,1.9144,1.4288,2.3167,stable,strong-growth,stable,Composite of z-scores of 12-month change in Industrial Production (INDPRO) and Retail Sales ex-Autos (RSXFS)
US_HOUS1,US,Macro,Housing,Permits,Housing / Construction,2026-05-15,-2.223816,0.186,0.1921,-0.136,1.5389,1.5176,stable,neutral,stable [leading],Building Permits (PERMIT) – 12-month % change and z-score
US_M2,US,Macro,Money / Liquidity,M2,Liquidity,2026-05-15,3.902647,0.7719,0.7817,0.9008,1.1686,1.1534,fading,neutral,stable,M2 Money Supply (M2SL) – YoY % change and z-score
GL_CLI1,Global,CLI,Leading Indicators,Regional Differential,Regional growth diff (US v EU),2026-05-15,0.0054,0.2,0.2115,-0.0298,-0.5323,0.5539,stable,neutral,stable [leading],"USA_CLI minus avg(DEU_CLI, FRA_CLI). EA19 composite not available in OECD pull; DEU+FRA equal-weight average used as Eurozone proxy."
GL_CLI2,Global,CLI,Leading Indicators,Regional Differential,Regional growth diff (US v CHN),2026-05-15,2.0461,1.7639,1.794,1.8959,2.1405,2.1045,stable,US-leads-China,stable [leading],USA_CLI minus CHN_CLI.
EU_CLI1,Europe,CLI,Leading Indicators,Regional Composite,Europe block CLI state,2026-05-15,100.832667,1.5108,1.5288,1.6707,1.944,1.9214,stable,EU-above-trend,stable [leading],"Equal-weight average of DEU_CLI, FRA_CLI, GBR_CLI (ITA excluded — not consistently available in OECD pull)."
AS_CLI1,Asia,CLI,Leading Indicators,Regional Composite,Asia (China-centred) CLI state,2026-05-15,100.020767,0.743,0.7439,0.2607,-0.5407,0.7447,stable,near-trend,stable [leading],"Equal-weight average of CHN_CLI, JPN_CLI, AUS_CLI."
GL_CLI5,Global,CLI,Leading Indicators,Breadth,Global growth breadth,2026-05-15,0.666667,1.3601,1.3794,1.8407,2.6892,2.613,fading,mixed,stable [leading],"Fraction of 9 countries (USA, DEU, FRA, GBR, ITA, JPN, CHN, AUS, CAN) where CLI > 100 AND CLI > CLI_26W_ago (above trend and improving simultaneously). Raw value = 0.0 to 1.0."
US_CLI1,US,CLI,Leading Indicators,Single Country,US CLI state,2026-05-15,100.8471,2.1539,2.1902,2.1879,2.1331,2.2682,stable,US-above-trend,stable [leading],USA_CLI (OECD amplitude-adjusted composite leading indicator).
CA_CLI1,Global,CLI,Leading Indicators,Single Country,Canada CLI state,2026-05-15,101.6715,1.8672,1.902,1.9656,2.1753,2.1467,stable,Canada-above-trend,stable [leading],CAN_CLI (OECD amplitude-adjusted composite leading indicator).
DE_CLI1,Europe,CLI,Leading Indicators,Single Country,Germany CLI state,2026-05-15,100.8956,1.5385,1.5623,1.6646,1.9426,1.9061,stable,Germany-above-trend,stable [leading],DEU_CLI (OECD amplitude-adjusted composite leading indicator).
FR_CLI1,Europe,CLI,Leading Indicators,Single Country,France CLI state,2026-05-15,100.7878,2.0162,2.0581,2.2786,2.991,2.8892,fading,France-above-trend,stable [leading],FRA_CLI (OECD amplitude-adjusted composite leading indicator).
UK_CLI1,UK,CLI,Leading Indicators,Single Country,UK CLI state,2026-05-15,100.8146,0.7017,0.7064,0.8278,0.9587,0.9594,fading,near-trend,stable [leading],GBR_CLI (OECD amplitude-adjusted composite leading indicator).
IT_CLI1,Europe,CLI,Leading Indicators,Single Country,Italy CLI state,2026-05-15,100.643,1.4016,1.422,1.6798,2.2856,2.2373,fading,Italy-above-trend,stable [leading],ITA_CLI (OECD amplitude-adjusted composite leading indicator).
JP_CLI1,Japan,CLI,Leading Indicators,Single Country,Japan CLI state,2026-05-15,100.3417,2.493,2.5584,2.4354,2.1691,2.6282,stable,Japan-above-trend,stable [leading],JPN_CLI (OECD amplitude-adjusted composite leading indicator).
CN_CLI1,Asia,CLI,Leading Indicators,Single Country,China CLI state,2026-05-15,98.801,-1.5057,-1.5287,-1.6713,-1.9729,1.9484,stable,China-below-trend,stable [leading],CHN_CLI (OECD amplitude-adjusted composite leading indicator).
AU_CLI1,Asia,CLI,Leading Indicators,Single Country,Australia CLI state,2026-05-15,100.9196,1.9603,1.9996,2.0241,2.1398,2.1701,stable,Australia-above-trend,stable [leading],AUS_CLI (OECD amplitude-adjusted composite leading indicator).
US_G3,US,Equity,Equity,Sector Rotation,Growth / banks vs utilities,2026-05-15,2.564371,0.671,0.7222,0.802,0.6798,0.8841,fading,neutral,stable,S&P 500 Banks (^SP500-4010) / S&P 500 Utilities
US_EQ_F4,US,Equity Factor,Equity,Size,Size cycle (S&P),2026-05-15,-0.979347,-0.3809,0.0459,0.1503,-0.0847,0.5711,stable,neutral,stable,Russell 2000 / S&P 500
US_EQ_F2,US,Equity Factor,Equity,Style,Style / value vs growth (S&P 500),2026-05-15,0.491253,-1.847,-1.7659,-1.3911,-0.7602,1.847,intensifying,growth-regime,stable,S&P 500 Value ETF (IVE) / S&P 500 Growth ETF (IVW)
US_R3,US,Rates,Rates / Yields,Yield Curve,Yield-curve slope (market return),2026-05-15,0.595,1.1069,0.8547,1.0368,1.3974,1.2828,stable,steep,stable,US 10-Year Treasury Yield (^TNX yfinance) minus US 2-Year Treasury Yield (DGS2 FRED)
US_CA_G1,US,Cross-Asset,Cross-Asset,Risk-On/Off,Risk-on vs risk-off,2026-05-15,3.488906,1.9353,1.8585,1.5857,1.308,1.9353,intensifying,risk-on,stable,S&P 500 ETF (SPY) / ICE BofA US Treasury Index (GOVT)
US_Cr4,US,Credit,Credit / Spreads,HY vs Treasuries,HY vs treasuries (credit risk),2026-05-15,-3.162037,1.6713,1.4084,1.4132,1.2719,1.6713,intensifying,credit-appetite,stable,iShares USD High Yield Corp Bond UCITS ETF (IHYU.L) / ICE BofA US Treasury Index (GOVT)
US_G5,US,Equity,Equity,Sector Rotation,Growth / technology leadership,2026-05-15,-0.041771,3.4,3.7066,1.692,0.5481,3.7066,stable,tech-led,improving,Invesco QQQ Trust (QQQ) / SPDR S&P 500 ETF (SPY)
US_G4,US,Equity,Equity,Breadth,Growth / market breadth,2026-05-15,-1.299441,-2.0832,-1.8425,-1.2719,-0.6758,2.0832,intensifying,narrow-concentrated,stable,S&P 500 Equal-Weight ETF (RSP) / SPDR S&P 500 ETF (SPY)
US_ISM1,US,Survey,Sentiment / Survey,PMI,Leading / ISM Manufacturing New Orders,2026-05-15,47.7,-0.1367,-0.1307,-0.1087,-0.0476,0.1367,intensifying,contraction,stable [leading],ISM Manufacturing New Orders Index (NAPMOI via FRED monthly)
US_R6,US,Rates,Housing,Mortgage Spread,Rates / mortgage affordability,2026-05-15,1.89,-1.7443,-1.4593,-1.3677,-1.5637,2.1546,stable,housing-easy,stable,30-Year Fixed Mortgage Rate (MORTGAGE30US FRED) minus 10-Year Treasury Yield (DGS10 FRED)
US_JOBS2,US,Macro,Labour,Tightness,Labour market / JOLTS tightness,2026-05-15,0.931236,-0.9606,-0.9692,-0.9878,-1.1186,1.1086,stable,neutral,stable [leading],JOLTS Job Openings (JTSJOL FRED) / Unemployed Persons (UNEMPLOY FRED)
EU_R1,Europe,Rates,Rates / Yields,Cross-Country Spread,BTP-Bund,2026-05-15,0.736684,-1.3452,-1.3585,-1.4032,-1.8138,1.7863,stable,compressed,stable,Italy 10-Year Govt Bond Yield (IRLTLT01ITM156N FRED) minus Germany 10-Year Bund Yield (IRLTLT01DEM156N FRED)
EU_G1,Europe,Equity,Equity,Regional Leadership,Eurozone vs global equities,2026-05-15,-1.109172,-0.5429,-0.0403,0.5096,0.7904,0.9912,reversing,neutral,stable,iShares MSCI Eurozone ETF (EZU) / iShares MSCI World ETF (URTH)
JP_G1,Japan,Equity,Equity,Regional Leadership,Japan vs global equities,2026-05-15,-0.786289,0.2806,0.4491,0.4632,1.8335,1.3694,fading,neutral,stable,iShares MSCI Japan ETF (EWJ) / iShares MSCI World ETF (URTH)
FX_2,FX & Commodities,FX,FX,Carry,JPY carry trade signal,2026-05-15,0.026156,-0.0178,-0.0341,0.6265,0.2934,1.0286,reversing,neutral,stable [leading],USD/JPY (USDJPY=X) 26-week log momentum
AS_CN_G1,Asia,Equity,Equity,Regional Leadership,China vs broad EM divergence,2026-05-15,-0.586404,-1.9207,-2.1004,-1.4709,-1.006,2.1004,stable,China-underperform-EM,stable,iShares China Large-Cap ETF (FXI) / iShares MSCI EM ETF (EEM) in USD
GL_G2,Global,Cross-Asset,Cross-Asset,Risk-On/Off,Global multi-asset risk appetite,2026-05-15,1.92085,2.0556,2.0657,1.8666,1.681,2.0657,stable,risk-on,stable,iShares MSCI ACWI ETF (ACWI) / ICE BofA US Treasury Index (GOVT)
GL_G1,Global,Cross-Asset,Equity,Regional Leadership,EM vs DM equity relative cycle,2026-05-15,-1.122454,1.9923,2.7311,2.0484,1.7764,2.7311,stable,em-outperform,stable,iShares MSCI Emerging Markets ETF (EEM) / iShares MSCI World ETF (URTH) in USD
FX_CMD6,FX & Commodities,Momentum,Momentum,Commodity Trend,Global commodity cycle momentum,2026-05-15,0.41967,3.4229,3.3229,2.9589,1.3366,3.7607,stable,commodity-bull,stable,Invesco DB Commodity Index Tracking Fund (DBC) 52-week log return
FX_CMD3,FX & Commodities,Inflation,Cross-Asset,Commodity Ratio,Oil vs gold inflation regime,2026-05-15,-3.766204,-0.2945,-0.659,-1.101,-2.0781,1.9464,fading,neutral,stable,WTI Crude Oil (CL=F) / Gold (GC=F) log-ratio
FX_EM1,FX & Commodities,FX,FX,EMFX Basket,EMFX basket momentum vs USD,2026-05-15,-0.009994,-0.2847,0.3986,0.0994,0.1909,1.0331,stable,neutral,stable,"Equal-weight basket of CNY, INR, KRW, TWD vs USD (each FX=X quote inverted so rising basket = EM currencies strengthening). Raw = log(basket / 26-week SMA)."
US_PMI1,US,Survey,Sentiment / Survey,PMI,ISM Manufacturing PMI,2026-05-15,10.3,-1.921,-1.9586,-2.0817,-2.5916,2.5202,stable,contraction,stable [leading],ISM Manufacturing PMI (DB.nomics ISM/pmi)
US_PMI2,US,Survey,Sentiment / Survey,PMI,ISM Manufacturing New Orders,2026-05-15,47.7,-0.1367,-0.1307,-0.1087,-0.0476,0.1367,intensifying,contraction,stable [leading],ISM Manufacturing New Orders sub-index (DB.nomics ISM/neword)
US_SVC1,US,Survey,Sentiment / Survey,PMI,ISM Services PMI,2026-05-15,52.0,-0.117,-0.1184,-0.1173,-0.1607,0.149,stable,neutral,stable [leading],ISM Services PMI (DB.nomics ISM/nm-pmi)
EU_PMI1,Europe,Survey,Sentiment / Survey,PMI,Eurozone Manufacturing PMI proxy,2026-05-15,-9.0,0.641,0.5887,0.446,0.1384,0.641,intensifying,contraction,stable [leading],EC Industry Confidence (DB.nomics Eurostat ei_bssi_m_r2) — same 3 PMI questions
EU_PMI2,Europe,Survey,Sentiment / Survey,PMI,Eurozone Services PMI proxy,2026-05-15,5.6,0.1582,0.1381,0.09,-0.0011,0.1582,intensifying,contraction,stable [leading],EC Services Confidence (DB.nomics Eurostat ei_bssi_m_r2)
EU_ESI1,Europe,Survey,Sentiment / Survey,Composite Sentiment,EC Economic Sentiment Indicator (EA),2026-05-15,96.7,1.037,0.9984,0.9044,0.6922,1.037,intensifying,above-avg-sentiment,stable [leading],EC Economic Sentiment Indicator for EA (DB.nomics Eurostat)
DE_ZEW1,Europe,Survey,Sentiment / Survey,Business Sentiment,ZEW Economic Sentiment,,,,,,,,,Insufficient Data,n/a,PROPRIETARY — ZEW Mannheim licences historical archive. No free API.
DE_IFO1,Europe,Survey,Sentiment / Survey,Business Sentiment,IFO Business Climate,2026-05-15,86.6,0.0973,0.0673,-0.0059,0.3756,0.534,stable,neutral,stable [leading],IFO Business Climate Index (ifo Institute Excel)
UK_PMI1,Europe,Survey,Sentiment / Survey,PMI,UK Manufacturing PMI proxy,2026-05-15,-14.157362,-0.5593,-0.5624,-0.574,-0.4121,0.6324,stable,contraction,stable [leading],OECD Business Confidence for UK (FRED BSCICP02GBM460S) — CBI-survey-derived monthly
JP_PMI1,Japan,Survey,Sentiment / Survey,PMI,Japan Manufacturing PMI,,,,,,,,,Insufficient Data,n/a,PROPRIETARY — S&P Global / au Jibun Bank. BoJ Tankan (quarterly) is best free alternative.
CN_PMI1,Asia,Survey,Sentiment / Survey,PMI,China Manufacturing PMI proxy,2026-05-15,0.6,1.2599,1.2746,1.3233,-0.9461,1.5708,stable,contraction,stable [leading],OECD Business Confidence for China (FRED CHNBSCICP02STSAM) — NBS PMI-derived monthly
CN_PMI2,Asia,Survey,Sentiment / Survey,PMI,Caixin China Manufacturing PMI,,,,,,,,,Insufficient Data,n/a,PROPRIETARY — S&P Global / Caixin. Chinese manufacturing covered by CN_PMI1 (OECD BCI).
GL_PMI1,Global,Survey,Sentiment / Survey,PMI,Global Manufacturing Survey Composite,2026-05-15,-0.144872,1.2544,1.2293,1.1525,-0.4257,1.844,stable,global-contraction,stable [leading],Z-score-normalised average: US ISM + EZ ICI + UK OECD BCI + CN OECD BCI
GLOBAL_GOLD1,Global,Cross-Asset,Cross-Asset,Precious Metals,LBMA Gold Price (PM Fix),,,,,,,,,Insufficient Data,n/a,LBMA Gold Price PM Fix in USD/oz (sources/nasdaq_data_link.py LBMA/GOLD)
